<?xml version="1.0" encoding="UTF-8"?>
<!--Sample XML file generated by XMLSpy v2008 (http://www.altova.com)-->
<Objects xsi:noNamespaceSchemaLocation="H:\mijn%20documenten\CONNEXION\Systeembeschrijving\Indeling%20XML%20berichten\ObjectInformation.xsd" xmlns:xsi="http://www.w3.org/2001/XMLSchema-instance">
	<ObjectInformation>
		<ObjectName>String</ObjectName>
		<MeasurePoint>String</MeasurePoint>
		<FieldNo>String</FieldNo>
	</ObjectInformation>
	<ObjectInformation>
		<ObjectName>String</ObjectName>
		<MeasurePoint>String</MeasurePoint>
		<FieldNo>String</FieldNo>
	</ObjectInformation>
	<ObjectInformation>
		<ObjectName>String</ObjectName>
		<MeasurePoint>String</MeasurePoint>
		<FieldNo>String</FieldNo>
	</ObjectInformation>
	<ObjectInformation>
		<ObjectName>String</ObjectName>
		<MeasurePoint>String</MeasurePoint>
		<FieldNo>String</FieldNo>
	</ObjectInformation>
</Objects>
